{
  "schema_version": "1.0.0",
  "corpus_id": "adml.evaluation.corpus.baseline_v2",
  "corpus_version": "0.2.0",
  "contract_ref": "adml.evaluation.dataset.v1",
  "schema_ref": "evaluation_case.v1",
  "split_rule": "heldout-v1:sha256(case_id)mod100<25",
  "held_out_percent": 25,
  "created_utc": "2026-09-14T00:00:00Z",
  "generated_by": "scripts/expand_corpus_v2.py",
  "generator_digest_sha256": "3bf09db7da42e11ea1d55a05bb845b0876e25f7c27a8a5d98f8ab11e268860d5",
  "parent_corpus": {
    "corpus_id": "adml.evaluation.corpus.baseline",
    "case_count": 50,
    "content_digest_sha256": "99a6515f3488f25e4ebaaf44880b42779b5671bd0045d92f793d37b475baded9"
  },
  "license_status": "MIT (project-original, synthetic and hand-authored content only)",
  "sanitization_policy": {
    "secrets": "New cases use placeholders only (EXAMPLE_TOKEN, SAMPLE_API_KEY, DATA_PLACEHOLDER); credential-shaped strings fail intake scanning.",
    "pii": "No real names, addresses, or identifiers; email/ID/phone patterns fail intake scanning except example-namespace hosts.",
    "live_targets": "New content may only reference example.com/example.org/example.net/example.edu/*.example/*.invalid/*.test/*.local; live-target findings fail intake scanning.",
    "legacy_notes": "Baseline v1 rows are retained byte-stable including fictional legacy hostnames; they are documented here and excluded from v2 intake scanning."
  },
  "families": {
    "clean": {
      "case_count": 37,
      "benign_hard_negatives": 0,
      "held_out_count": 6,
      "generation_methods": {
        "import": 13,
        "manual": 24
      }
    },
    "context_tampering": {
      "case_count": 24,
      "benign_hard_negatives": 7,
      "held_out_count": 8,
      "generation_methods": {
        "import": 8,
        "manual": 15,
        "paraphrase": 1
      }
    },
    "data_exfiltration": {
      "case_count": 24,
      "benign_hard_negatives": 7,
      "held_out_count": 1,
      "generation_methods": {
        "import": 4,
        "manual": 18,
        "paraphrase": 1,
        "template_mutation": 1
      }
    },
    "inference_evasion": {
      "case_count": 28,
      "benign_hard_negatives": 11,
      "held_out_count": 10,
      "generation_methods": {
        "encoding": 3,
        "import": 8,
        "manual": 17
      }
    },
    "jailbreak": {
      "case_count": 22,
      "benign_hard_negatives": 7,
      "held_out_count": 5,
      "generation_methods": {
        "encoding": 1,
        "import": 4,
        "manual": 16,
        "template_mutation": 1
      }
    },
    "many_shot": {
      "case_count": 8,
      "benign_hard_negatives": 4,
      "held_out_count": 1,
      "generation_methods": {
        "manual": 7,
        "template_mutation": 1
      }
    },
    "prompt_injection": {
      "case_count": 30,
      "benign_hard_negatives": 9,
      "held_out_count": 7,
      "generation_methods": {
        "import": 10,
        "manual": 20
      }
    },
    "rag_poisoning": {
      "case_count": 19,
      "benign_hard_negatives": 6,
      "held_out_count": 6,
      "generation_methods": {
        "import": 3,
        "manual": 14,
        "paraphrase": 2
      }
    },
    "tool_misuse": {
      "case_count": 12,
      "benign_hard_negatives": 4,
      "held_out_count": 1,
      "generation_methods": {
        "manual": 12
      }
    }
  },
  "cases": {
    "clean_chat_code": {
      "schema_version": "1.0.0",
      "source": "dataset_import",
      "generation_method": "import",
      "generated_by": "baseline-v1-authoring",
      "seed": null,
      "attack_class": "clean",
      "secondary_tags": [
        "baseline_v1",
        "benign_control"
      ],
      "target_model": "model-agnostic",
      "parent_sample_id": null,
      "content_hash_sha256": "e16f0478d17f071e17ef8531bd3f1bd1c21861960229bea85346d5c9d0cf1e95",
      "normalized_hash_sha256": "56385d7717f85d5ae84c34fe792a42fd6fc14ccd458634f2060edd7423c27316",
      "scrub_status": "not_required",
      "review_status": "approved",
      "reviewer": "mayur",
      "held_out": false,
      "derivation_note": "Inherited byte-stable from baseline v1 (dataset digest recorded in parent_corpus). Serves as a benign control."
    },
    "clean_chat_definition": {
      "schema_version": "1.0.0",
      "source": "human",
      "generation_method": "manual",
      "generated_by": "corpus-v2-authoring",
      "seed": null,
      "attack_class": "clean",
      "secondary_tags": [],
      "target_model": "model-agnostic",
      "parent_sample_id": null,
      "content_hash_sha256": "f803a64497d207df37ae3dc4f1defb8ca734eff089cf932fb51e1ab694aa2ca8",
      "normalized_hash_sha256": "c7fcf41fe9e64e1bb6ccfd778112593abf8b7dcdfcc8a0de1d0ae4813d1d1cd1",
      "scrub_status": "cleaned",
      "review_status": "in_review",
      "reviewer": "mayur",
      "held_out": false,
      "derivation_note": "Baseline clean educational chat control."
    },
    "clean_chat_greeting": {
      "schema_version": "1.0.0",
      "source": "dataset_import",
      "generation_method": "import",
      "generated_by": "baseline-v1-authoring",
      "seed": null,
      "attack_class": "clean",
      "secondary_tags": [
        "baseline_v1",
        "benign_control"
      ],
      "target_model": "model-agnostic",
      "parent_sample_id": null,
      "content_hash_sha256": "c6d3f486fae151ce2d3fbaa8a2e4a9d353da1af32aff06b40ddce5f6754f4a13",
      "normalized_hash_sha256": "9d2c7971d64d590363abc0ef32e02ca27a67ee57847a13b8d2aef9e02342065f",
      "scrub_status": "not_required",
      "review_status": "approved",
      "reviewer": "mayur",
      "held_out": false,
      "derivation_note": "Inherited byte-stable from baseline v1 (dataset digest recorded in parent_corpus). Serves as a benign control."
    },
    "clean_chat_joke": {
      "schema_version": "1.0.0",
      "source": "dataset_import",
      "generation_method": "import",
      "generated_by": "baseline-v1-authoring",
      "seed": null,
      "attack_class": "clean",
      "secondary_tags": [
        "baseline_v1",
        "benign_control"
      ],
      "target_model": "model-agnostic",
      "parent_sample_id": null,
      "content_hash_sha256": "12ed80845de7484bc43a2faba36fdd8299a2e9c58dbb62f43605015a60bc3820",
      "normalized_hash_sha256": "ada9cb9d1a82f6d62d2fc5db95031379c73690361e6dbb560c18872d900b52ce",
      "scrub_status": "not_required",
      "review_status": "approved",
      "reviewer": "mayur",
      "held_out": false,
      "derivation_note": "Inherited byte-stable from baseline v1 (dataset digest recorded in parent_corpus). Serves as a benign control."
    },
    "clean_chat_pricing": {
      "schema_version": "1.0.0",
      "source": "human",
      "generation_method": "manual",
      "generated_by": "corpus-v2-authoring",
      "seed": null,
      "attack_class": "clean",
      "secondary_tags": [],
      "target_model": "model-agnostic",
      "parent_sample_id": null,
      "content_hash_sha256": "13741a1a291743bde6e2d1bf1a22f95dd95b5fdb1167c8b186c486a98ace386c",
      "normalized_hash_sha256": "545f86e610fab771d7206619ef3c292466ac8f2c5af0c68dd0d2b2cb4f0f2349",
      "scrub_status": "cleaned",
      "review_status": "in_review",
      "reviewer": "mayur",
      "held_out": false,
      "derivation_note": "Baseline clean pricing chat control."
    },
    "clean_chat_support": {
      "schema_version": "1.0.0",
      "source": "dataset_import",
      "generation_method": "import",
      "generated_by": "baseline-v1-authoring",
      "seed": null,
      "attack_class": "clean",
      "secondary_tags": [
        "baseline_v1",
        "benign_control"
      ],
      "target_model": "model-agnostic",
      "parent_sample_id": null,
      "content_hash_sha256": "e2d47aa1688f7affaea75b5ab54eba9abfb831cf57faecc1aa67a1ab46d26203",
      "normalized_hash_sha256": "3085d9f1865b07e4bd0b934d45d27514645c758da50fc35c83f9579be1f36a9b",
      "scrub_status": "not_required",
      "review_status": "approved",
      "reviewer": "mayur",
      "held_out": true,
      "derivation_note": "Inherited byte-stable from baseline v1 (dataset digest recorded in parent_corpus). Serves as a benign control."
    },
    "clean_chat_translate": {
      "schema_version": "1.0.0",
      "source": "human",
      "generation_method": "manual",
      "generated_by": "corpus-v2-authoring",
      "seed": null,
      "attack_class": "clean",
      "secondary_tags": [],
      "target_model": "model-agnostic",
      "parent_sample_id": null,
      "content_hash_sha256": "3c5957461efd62fd813bbbcc8a2a67953502922331864e9517b0d874d15fe01a",
      "normalized_hash_sha256": "0c2c09b2b720ef5bc576b0fcc2c3e6dbbeb648940db03a0156bc8eae8a06abae",
      "scrub_status": "cleaned",
      "review_status": "in_review",
      "reviewer": "mayur",
      "held_out": false,
      "derivation_note": "Baseline clean translation chat control."
    },
    "clean_chat_weather": {
      "schema_version": "1.0.0",
      "source": "dataset_import",
      "generation_method": "import",
      "generated_by": "baseline-v1-authoring",
      "seed": null,
      "attack_class": "clean",
      "secondary_tags": [
        "baseline_v1",
        "benign_control"
      ],
      "target_model": "model-agnostic",
      "parent_sample_id": null,
      "content_hash_sha256": "96ea89e9fb560ec631f2e83432d0387b5e475cdbd8de1d91476e44827ea65155",
      "normalized_hash_sha256": "0e345267747aa6f98d055967d1246017729368a408dd3afa70be433a26bf641f",
      "scrub_status": "not_required",
      "review_status": "approved",
      "reviewer": "mayur",
      "held_out": true,
      "derivation_note": "Inherited byte-stable from baseline v1 (dataset digest recorded in parent_corpus). Serves as a benign control."
    },
    "clean_classify_priority": {
      "schema_version": "1.0.0",
      "source": "human",
      "generation_method": "manual",
      "generated_by": "corpus-v2-authoring",
      "seed": null,
      "attack_class": "clean",